{
  "$ref": "#/definitions/socials",
  "definitions": {
    "socials": {
      "type": "object",
      "properties": {
        "id": {
          "type": "number"
        },
        "icon": {
          "anyOf": [
            {
              "type": "object",
              "properties": {
                "type": {
                  "type": "string",
                  "const": "lucide"
                },
                "name": {}
              },
              "required": [
                "type"
              ],
              "additionalProperties": false
            },
            {
              "type": "object",
              "properties": {
                "type": {
                  "type": "string",
                  "const": "simple-icons"
                },
                "name": {}
              },
              "required": [
                "type"
              ],
              "additionalProperties": false
            }
          ]
        },
        "text": {
          "type": "string"
        },
        "link": {
          "type": "string",
          "format": "uri"
        },
        "$schema": {
          "type": "string"
        }
      },
      "required": [
        "id",
        "icon",
        "text",
        "link"
      ],
      "additionalProperties": false
    }
  },
  "$schema": "http://json-schema.org/draft-07/schema#"
}