[
  {
    "id": 1,
    "icon": {
      "type": "lucide",
      "name": "github"
    },
    "text": "GitHub",
    "link": "https://github.com/zachwong02"
  },
  {
    "id": 2,
    "icon": {
      "type": "lucide",
      "name": "linkedin"
    },
    "text": "LinkedIn",
    "link": "https://www.linkedin.com/in/zachwong02/"
  }
]